<?xml version="1.0" encoding="UTF-8"?>
    <p:DataRuleFunctionsLibrary xmlns:p="http://www.ibm.com/infosphere/dataquality/datarulefunctionslibrary" xmlns:xsi="http://www.w3.org/2001/XMLSchema-instance" xsi:schemaLocation="http://www.ibm.com/infosphere/dataquality/datarulefunctionslibrary ../xsd/DataRuleFunctionsLibrary.xsd " name="Built in functions library" provider="IBM" version="1.10.0">

        <description>Built in data quality rules functions and tests.</description>

        <!--
		##################################################
		###################	Categories ###################
		##################################################
	-->
        <Categories>
            <Category id="general" name="General">
                <description>Functions for general purposes</description>
            </Category>
            <Category id="date/time" name="%category.datetime.name">
                <description>%category.datetime.desc</description>
            </Category>
            <Category id="math" name="%category.math.name">
                <description>%category.math.desc</description>
            </Category>
            <Category id="string" name="%category.string.name">
                <description>%category.string.desc</description>
            </Category>
        </Categories>

        <!--
		##################################################
		###################	Functions ####################
		##################################################
	-->
        <DataRuleFunctions>
            <DataRuleFunction categoryID="general" className="com.ibm.infosphere.dataquality.ruleengine.functions.Coalesce" displayName="replace missing value for %1 with %2" name="coalesce" returnType="any">
                <description>Replace a missing value with a specific value</description>
                <Parameter name="value" type="any">
                    <description>%function.coalesce.param1.desc</description>
                </Parameter>
                <Parameter name="replacementValue" optional="true" type="any">
                    <description>%function.coalesce.param2.desc</description>
                </Parameter>
            </DataRuleFunction>

            <DataRuleFunction categoryID="general" className="com.ibm.infosphere.dataquality.ruleengine.functions.Count" displayName="Number of distinct values of %1 grouped by %2" executionType="precomputedAggregation" name="count" returnType="numeric">
                <description>Aggregate function, provides a count of the number of distinct values of a given column</description>
                <Parameter column="true" name="column" type="any">
                    <description>%function.count.param1.desc</description>
                </Parameter>
                <Parameter column="true" name="groupBy" optional="true" type="any">
                    <description>%function.count.param2.desc</description>
                </Parameter>
            </DataRuleFunction>

            <DataRuleFunction categoryID="general" className="com.ibm.infosphere.dataquality.ruleengine.functions.CountNotNull" displayName="Number of non null values of %1 grouped by %2" executionType="precomputedAggregation" name="count_not_null" returnType="numeric">
                <description>Aggregate function, provides a count of the number of non null values of a given column</description>
                <Parameter column="true" name="column" type="any">
                    <description>%function.count_non_null.param1.desc</description>
                </Parameter>
                <Parameter column="true" name="groupBy" optional="true" type="any">
                    <description>%function.count_non_null.param2.desc</description>
                </Parameter>
            </DataRuleFunction>

            <DataRuleFunction categoryID="general" className="com.ibm.infosphere.dataquality.ruleengine.functions.DataClassesOf" displayName="Data classes matched by %1" name="dataclassesof" returnType="list">
                <description>Returns the list of data classes matched by a value</description>
                <Parameter name="value" type="any">
                    <description>%function.dataclassesof.param1.desc</description>
                </Parameter>
            </DataRuleFunction>

            <DataRuleFunction categoryID="general" className="com.ibm.infosphere.dataquality.ruleengine.functions.Lookup" displayName="lookup %1 from reference key %2 and reference value %3" executionType="precomputedAggregation" name="lookup" returnType="any">
                <description>Replace a value with another value defined in a lookup table</description>
                <Parameter name="value" type="any">
                    <description>%function.lookup.param1.desc</description>
                </Parameter>
                <Parameter name="refkey" refcolumn="true" type="any">
                    <description>%function.lookup.param2.desc</description>
                </Parameter>
                <Parameter name="refvalue" refcolumn="true" type="any">
                    <description>%function.lookup.param3.desc</description>
                </Parameter>
            </DataRuleFunction>

            <DataRuleFunction categoryID="general" className="com.ibm.infosphere.dataquality.ruleengine.functions.Occurrences" displayName="Frequency of %1" executionType="precomputedAggregation" name="occurrences" returnType="numeric">
                <description>Aggregate function, provides the number of occurrences of each value of a given column</description>
                <Parameter column="true" name="column" type="any">
                    <description>%function.occurrences.param1.desc</description>
                </Parameter>--&gt;
                <!-- 			<Parameter type="any" name="groupBy" optional="true" column="true">
				<description>%function.occurrences.param2.desc</description>
			</Parameter>-->
            </DataRuleFunction>
            <DataRuleFunction categoryID="date/time" className="com.ibm.infosphere.dataquality.ruleengine.functions.Date" displayName="current date" name="date" returnType="date">
                <description>Returns the system date from the computer as a date value</description>
            </DataRuleFunction>

            <DataRuleFunction categoryID="date/time" className="com.ibm.infosphere.dataquality.ruleengine.functions.DateValue" displayName="convert %1 to date using format %2" name="datevalue" returnType="date">
                <description>Converts the string representation of a date into a date value</description>
                <Parameter name="string" type="string">
                    <description>%function.datevalue.param1.desc</description>
                </Parameter>
                <Parameter name="format" optional="true" type="string">
                    <description>%function.datevalue.param2.desc</description>
                </Parameter>
            </DataRuleFunction>

            <DataRuleFunction categoryID="date/time" className="com.ibm.infosphere.dataquality.ruleengine.functions.Day" displayName="day of date %1" name="day" returnType="numeric">
                <description>Given a date, returns a number representing the day of the month for that date</description>
                <Parameter name="date" type="date">
                    <description>%function.day.param1.desc</description>
                </Parameter>
            </DataRuleFunction>

            <DataRuleFunction categoryID="date/time" className="com.ibm.infosphere.dataquality.ruleengine.functions.Month" displayName="month of date %1" name="month" returnType="numeric">
                <description>Given a date, returns a number representing the month for that date</description>
                <Parameter name="date" type="date">
                    <description>%function.month.param1.desc</description>
                </Parameter>
            </DataRuleFunction>

            <DataRuleFunction categoryID="date/time" className="com.ibm.infosphere.dataquality.ruleengine.functions.RoundDate" displayName="round date %1 using format %2" name="round_date" returnType="date">
                <description>Returns a rounded value of a date</description>
                <Parameter name="value" type="date">
                    <description>%function.round_date.param1.desc</description>
                </Parameter>
                <Parameter name="format" type="string">
                    <description>%function.round_date.param2.desc</description>
                </Parameter>
            </DataRuleFunction>

            <DataRuleFunction categoryID="date/time" className="com.ibm.infosphere.dataquality.ruleengine.functions.RoundTime" displayName="round time %1 using format %2" name="round_time" returnType="time">
                <description>Returns a rounded value of a time</description>
                <Parameter name="value" type="time">
                    <description>%function.round_time.param1.desc</description>
                </Parameter>
                <Parameter name="format" type="string">
                    <description>%function.round_time.param2.desc</description>
                </Parameter>
            </DataRuleFunction>

            <DataRuleFunction categoryID="date/time" className="com.ibm.infosphere.dataquality.ruleengine.functions.RoundTimeStamp" displayName="round timestamp %1 using format %2" name="round_timestamp" returnType="timestamp">
                <description>Returns a rounded value of a time</description>
                <Parameter name="value" type="timestamp">
                    <description>%function.round_timestamp.param1.desc</description>
                </Parameter>
                <Parameter name="format" type="string">
                    <description>%function.round_timestamp.param2.desc</description>
                </Parameter>
            </DataRuleFunction>